{
  "schemaVersion": 1,
  "adapter": {
    "id": "open-connector",
    "version": "0.1.5"
  },
  "upstream": {
    "repository": "oomol-lab/open-connector",
    "release": "v1.3.4",
    "commit": "ef9ef5b6cf1f8c15368f0a62fc2517780aebc12a",
    "archiveUrl": "https://github.com/oomol-lab/open-connector/archive/ef9ef5b6cf1f8c15368f0a62fc2517780aebc12a.tar.gz",
    "archiveSha256": "fab962a043d989fa6d3231c4a5f733513eabd8516da377789d07ae6b2253535a"
  },
  "generatedAt": "2026-08-05T00:00:00.000Z"
}
